data/processed/yelp_top_negative_words_reviews.csv

word,count,happiness,kind
die,54,1.74,review
dead,22,2.0,review
sick,20,2.02,review
pain,62,2.1,review
worst,127,2.1,review
horrible,131,2.24,review
disappointed,213,2.26,review
sadly,24,2.28,review
poor,102,2.32,review
hate,42,2.34,review
sad,33,2.38,review
negative,47,2.42,review
shot,37,2.5,review
shit,20,2.5,review
ruined,20,2.54,review

READMEmp2_draft.md

##### Top negative (reviews):

The negative Yelp reviews considerably strong negative words; worst, die, cancer, horrible. With the lowest happiness_average score being 1.74 for the word 'die'. Just like the positive reviews, negative reviews used words to express their emotions such as 'sad' (2.38), 'hate'(2.34) and 'disappointed' (2.26) and words to describe their experience such as 'worst' (2.10), 'horrible' (2.24) and ruined (2.54). These words show us that the negative reviews were more than just light complaints, but intense negative reviews and 'disappointed'. Something to note is the most counted word was 213 (for the word disappointed), which is significantly less than the most used word for the positive word (being 756 for the word 'love').