data/processed/yelp_top_positive_words_tips.csv

word,count,happiness,kind
happiness,145,8.44,tip
love,48097,8.42,tip
happy,13589,8.3,tip
laughed,56,8.26,tip
laugh,130,8.22,tip
laughing,62,8.2,tip
excellent,21647,8.18,tip
laughs,56,8.18,tip
joy,219,8.16,tip
successful,54,8.16,tip
win,1078,8.12,tip
won,5137,8.1,tip
smile,799,8.1,tip
rainbow,146,8.1,tip
pleasure,363,8.08,tip

READMEmp2_draft.md

#### Reviews

Yelp reviews use strong positive words [love, happy, excellent] with these scores all between 8.18-8.42, with 'love' having the highest score of 8.42. There are multiple 'love' words such as 'love', 'loved' and 'loves' (as well as 'excellent', which is not part of the 'love' family, but is still a word that expresses emotion). This shows that people share their experience through these emotional terms. There are other words that express the experience such as 'music', 'weekend' and 'healthy'. These words are in the lower amount of counts from 52-250. These are not large amounts (especially compared to 'love' 'happy' and 'excellent' which all have 300-756 mentions) but can came in handy when comparing this with the tips. There are 10 words that reached a score of 8.00 or higher, and 5 words that had lower than 8.00.

#### Tips

Yelp tips have very positive words, 'love', 'happy', 'joy', 'beautiful', 'pleasure' all for example. The highest happiness score is 'happiness' with a 8.44. However, the most used word is 'love' with 48,097 uses and a 8.42 score. There is a 'laugh' family with 'laugh' (8.22), 'laughed' (8.26), 'laughing' (8.20) and 'laughs' (8.18). Not in this family but similar are 'happiness' and 'joy', which shows the playful and enthusiastic tone used throughout the Yelp tips. There are also words that show success, such as 'win' (8.12), 'won' (8.10), and successful (8.16). This fits in with tips as it's recommending things thats worth it.